{
  "sector_pack_id": "healthtech-us",
  "name": "Healthtech / Digital Health (US)",
  "description": "Curated framework bundle for US digital-health businesses — telehealth, remote-patient-monitoring, clinical-decision-support SaaS, payer / provider integrations and consumer health apps that touch PHI.",
  "version": "0.1.0",
  "required_frameworks": ["HIPAA", "SOC_2", "NIST_CSF"],
  "recommended_frameworks": ["ISO_27001", "NIST_AI_RMF", "GDPR"],
  "optional_frameworks": ["ISO_27701", "CCPA"],
  "crosswalk_pairs": [
    { "a": "ISO_27001", "b": "SOC_2", "rationale": "ISO 27001 Annex A.5 / A.8 controls evidence the SOC 2 Common Criteria — health-payer security questionnaires usually map both sides automatically." },
    { "a": "NIST_CSF", "b": "ISO_27001", "rationale": "CSF 2.0 functions cross-walk to ISO 27001 Clause 4.1 + Annex A.5 / A.8 — used by HHS / OCR and most health-system enterprise-security teams." },
    { "a": "GDPR", "b": "HIPAA", "rationale": "GDPR Art. 9 special-category protections + Art. 32 / 33 overlap with HIPAA §164.308 / §164.312 / §164.404 — re-use evidence when also serving EU patients or research subjects." },
    { "a": "GDPR", "b": "ISO_27701", "rationale": "ISO 27701 Annex C is the authoritative GDPR mapping — if you already operate ISO 27001, 27701 is the standards-based way to evidence GDPR for EU patient data." }
  ],
  "sequencing_notes": [
    "1. HIPAA first — Privacy Rule (§164.500 et seq.), Security Rule (§164.302–§164.318), Breach Notification Rule (§164.400 et seq.) plus BAA paper with every downstream processor.",
    "2. SOC 2 Type II is the standard buyer-side asks of provider IT and payer security teams — operate the 12-month observation window in parallel with HIPAA Security Rule controls.",
    "3. NIST CSF 2.0 as the organising taxonomy for risk reporting to clinical-IT governance committees.",
    "4. NIST AI RMF 1.0 if any clinical-decision-support, triage or prior-authorisation feature uses ML — FDA SaMD overlay applies for diagnostic claims.",
    "5. GDPR + ISO 27701 only if you process EU patient or research-subject data (clinical-trial sponsors, multi-region telehealth).",
    "6. CCPA / CPRA notice-at-collection and right-to-know flows where consumer-health (non-HIPAA) data is involved (wellness apps outside a HIPAA-covered relationship)."
  ],
  "last_reviewed": "2026-05-16"
}
